,Collection and processing methods were evaluated,Descriptive text is thorough enough to use or replicate the dataset,Necessary metadata is standardized (e.g. in XML),Technical details have been checked (e.g. no missing files no missing values),Plausibility considered based on area expertise,Novelty/impact considered
Collection and processing methods were evaluated,,0.0097602270168249718,0.0028836486795375082,7.2544322346375533e-05,0.0013536185514214046,0.37180414507151038
Descriptive text is thorough enough to use or replicate the dataset,,,0.0029242399357447915,0.00026251496219448456,3.5585206753217502e-06,0.45187229621984193
Necessary metadata is standardized (e.g. in XML),,,,1.1074493554942326e-05,0.84714410471452828,0.11665716468469113
Technical details have been checked (e.g. no missing files no missing values),,,,,0.0048661014905628779,0.18877965881472747
Plausibility considered based on area expertise,,,,,,3.7700876757119408e-05
Novelty/impact considered,,,,,,
